key,scope,resource_uri,table,field,ordinal,comment,filtering,description,title,ordering,json_field_type,vocabulary_scope_ref,visibility,data_type,display_type,edit_type,alias,is_restricted,display_options
name,fields.usergroup,/reports/api/v1/metahash/fields.usergroup/name/,,,0,,TRUE,"The group name",Name,TRUE,,,[list;detail],string,link,,,,"{ ""hrefTemplate"": ""#usergroup/{name}"" }"
users,fields.usergroup,/reports/api/v1/metahash/fields.usergroup/users/,custom,,9,,TRUE,"Users in the group","User URI List",TRUE,,,[list;detail],list,,multiselect,,,
super_groups,fields.usergroup,/reports/api/v1/metahash/fields.usergroup/super_groups/,custom,,3,,TRUE,"Usergroups this group is a member of (inherits permissions from)","Super Groups",TRUE,,,[list;detail],list,,multiselect,,,
sub_groups,fields.usergroup,/reports/api/v1/metahash/fields.usergroup/sub_groups/,custom,,4,,TRUE,"Usergroups that are members of this group (inherits users from)","Sub Groups",TRUE,,,[list;detail],list,,multiselect,,,
permissions,fields.usergroup,/reports/api/v1/metahash/fields.usergroup/permissions/,custom,,2,,TRUE,"Permissions for the group",Permissions,TRUE,,,[list;detail],list,,multiselect,,,
user_list,fields.usergroup,/reports/api/v1/metahash/fields.usergroup/user_list/,custom,,1,,TRUE,"User usernames assigned to this group",Usernames,TRUE,,,[list;detail],list,,,,,
all_sub_groups,fields.usergroup,/reports/api/v1/metahash/fields.usergroup/all_sub_groups/,custom,,5,,TRUE,"Usergroups that are a member of this group (inherits users from)","Sub Groups",TRUE,,,[list;detail],list,,,,,
all_users,fields.usergroup,/reports/api/v1/metahash/fields.usergroup/all_users/,custom,,7,,TRUE,"All users, including those from subgroups","All Users",TRUE,,,[list;detail],list,,,,,
all_permissions,fields.usergroup,/reports/api/v1/metahash/fields.usergroup/all_permissions/,custom,,8,,TRUE,"All permissions, including those from superGroups","All Permissions",TRUE,,,[list;detail],list,,,,,
