ordinal,comment,ui_type,filtering,description,title,ordering,json_field_type,vocabulary_scope_ref,visibility,alias,key,scope,backgrid_cell_type,resource_uri
3,comment on the comment!,string,True,The comment is additional information displayed in the detail view,Comment,True,fields.CharField,,"[detail,edit]",,comment,vocabularies:fields,,/reports/api/v1/metahash/vocabularies:fields/comment/
4,,string,True,The description is used in tooltips and other queues to the user,Description,True,fields.CharField,,"[list,detail,edit]",,description,vocabularies:fields,,/reports/api/v1/metahash/vocabularies:fields/description/
0,"This is a composite key, along with scope",string,True,The key field,Key,True,,,"[list,detail,edit]",,key,vocabularies:fields,,/reports/api/v1/metahash/vocabularies:fields/key/
1,"This is a composite key, along with key",string,True,The scope field,Scope,True,,,"[list,detail,edit]",,scope,vocabularies:fields,,/reports/api/v1/metahash/vocabularies:fields/scope/
3,The title of this field,string,True,The title is the label that is displayed to the end user,Title,True,fields.CharField,,"[list,detail,edit]",,title,vocabularies:fields,,/reports/api/v1/metahash/vocabularies:fields/title/
2,"The sort order counts from 0, if two are equal in a set, then secondary sort is by key (alpha)",integer,True,The order field determines sort order,Order By,True,,,"[list,detail,edit]",,ordinal,vocabularies:fields,,/reports/api/v1/metahash/vocabularies:fields/ordinal/
