key,scope,resource_uri,table,field,ordinal,comment,ui_type,filtering,description,title,ordering,json_field_type,vocabulary_scope_ref,visibility,alias,backgrid_cell_type,backgrid_cell_options,is_restricted
name,fields.usergroup,/reports/api/v1/metahash/fields.usergroup/name/,,,0,,string,TRUE,"The group name",Name,TRUE,,,[list;detail],,Iccbl.EditCell,,
users,fields.usergroup,/reports/api/v1/metahash/fields.usergroup/users/,custom,,9,,list,TRUE,"Users in the group","User URI List",TRUE,,,[list;detail],,,,
super_groups,fields.usergroup,/reports/api/v1/metahash/fields.usergroup/super_groups/,custom,,3,,list,TRUE,"Usergroups this group is a member of (inherits permissions from)","Super Groups",TRUE,,,[list;detail],,,,
sub_groups,fields.usergroup,/reports/api/v1/metahash/fields.usergroup/sub_groups/,custom,,4,,list,TRUE,"Usergroups that are members of this group (inherits users from)","Sub Groups",TRUE,,,[list;detail],,,,
permissions,fields.usergroup,/reports/api/v1/metahash/fields.usergroup/permissions/,custom,,2,,list,TRUE,"Permissions for the group",Permissions,TRUE,,,[list;detail],,,,
user_list,fields.usergroup,/reports/api/v1/metahash/fields.usergroup/user_list/,custom,,1,,list,TRUE,"User usernames assigned to this group",Usernames,TRUE,,,[list;detail],,,,
all_sub_groups,fields.usergroup,/reports/api/v1/metahash/fields.usergroup/all_sub_groups/,custom,,5,,list,TRUE,"Usergroups that are a member of this group (inherits users from)","Sub Groups",TRUE,,,[list;detail],,,,
all_users,fields.usergroup,/reports/api/v1/metahash/fields.usergroup/all_users/,custom,,7,,list,TRUE,"All users, including those from subgroups","All Users",TRUE,,,[list;detail],,,,
all_permissions,fields.usergroup,/reports/api/v1/metahash/fields.usergroup/all_permissions/,custom,,8,,list,TRUE,"All permissions, including those from superGroups","All Permissions",TRUE,,,[list;detail],,,,
